{
  "id": "openbit.runtime-activity",
  "kind": "preset",
  "title": "OpenBit Runtime Activity",
  "description": "Recent run activity list.",
  "root": {
    "id": "openbit.runtime-activity.root",
    "kind": "component",
    "component": "surface.card",
    "slots": {
      "children": [
        {
          "id": "openbit.runtime-activity.heading",
          "kind": "component",
          "component": "content.heading",
          "props": {
            "text": "Runtime Activity",
            "level": "h3"
          }
        },
        {
          "id": "openbit.runtime-activity.items",
          "kind": "component",
          "component": "layout.stack",
          "props": {
            "gap": 10
          },
          "slots": {
            "children": [
              {
                "id": "openbit.runtime-activity.collection",
                "kind": "collection",
                "bind": {
                  "items": "$data.items"
                },
                "slots": {
                  "template": {
                    "id": "openbit.runtime-activity.collection.template",
                    "kind": "component",
                    "component": "data.list-item",
                    "bind": {
                      "title": "$derived.item.name",
                      "subtitle": "$derived.item.summary",
                      "meta": "$derived.item.status"
                    }
                  }
                }
              }
            ]
          }
        }
      ]
    }
  }
}
